{"calibration":{"note":"Nominal 95 %, not calibrated. The locked Monte Carlo validation (hvsr-mc-validation-v1) did not meet its coverage targets: coverage was about 75 % under minute-scale H/V regime changes, and strongly low-frequency-dominated records produced no CI because the default anti-trigger rejects nearly every window. See docs/validation/report-v1.md.","profile":null,"status":"uncalibrated","validation":{"protocol_id":"hvsr-mc-validation-v1","protocol_sha256":"8768c5c50ece353b476b51915ed4038d6541026f3481dbf93d30d614333dc985","report":"docs/validation/report-v1.md","verdict":"not_met"}},"ci_label":"Estimated 95% pointwise CI for the selected-window mean","config":{"basic_qc":{"clip_detection":true,"clip_fraction_of_full_scale":0.995,"flat_top_run_samples":5,"lta_s":30.0,"sta_lta_enabled":true,"sta_lta_max":2.5,"sta_lta_min":0.2,"sta_s":1.0},"config_schema_version":"2.0.0","peak_discovery":{"family_listing_min_recurrence":0.1,"family_max_halfwidth_decades":0.12,"kde_bandwidth_decades":0.03,"kde_merge_valley_ratio":0.8,"lower_edge_min_hv":1.5,"mean_min_prominence_ratio":1.5,"min_discovery_windows":5,"min_recurrence":0.3,"narrow_line_max_width_bins":3,"narrow_line_min_contrast_ratio":3.0,"narrow_line_min_persistence":0.8,"smoothing_sensitivity_bandwidth":80.0,"window_min_prominence_ratio":1.25},"peak_search":{"fmax_hz":20.0,"fmin_hz":0.2},"preprocessing":{"bandpass":null,"detrend":"linear","response_correction":"none","taper_alpha":0.1,"taper_type":"tukey"},"sdof":{"calibration_profile":null,"extra_banks":[],"manual_n":null,"min_fft_bins_below_peak":4,"min_fft_bins_in_fit_band":10,"min_log_variance":1e-06,"peak_interpolation":"parabolic_log","r2_min":0.0,"selection_mode":"automatic","template_bank":"auto"},"spectral":{"anti_alias_fraction":0.8,"grid_fmax_hz":null,"grid_fmin_hz":null,"grid_points_per_decade":200,"horizontal_combination":"rms","ko_bandwidth":40.0,"ko_support_rad":3.0,"min_smoothing_bins":3,"processing_order":"combine_then_smooth","smoothing":"konno_ohmachi","vertical_floor_rel":1e-09},"standard_selection":{"fdwra_max_iterations":50,"fdwra_n_std":2.0,"frequency_outlier_rejection":"none"},"uncertainty":{"adjacent_block_corr_max":0.3,"dependence_test_alpha":0.05,"irregular_block_lw_factor":2.0,"max_block_doublings":3,"min_informative_blocks":10,"n_bootstrap":2000,"pw_min_windows":75,"regular_spacing_max_ratio":1.5,"seed":20261020,"sensitivity_factors":[0.5,2.0],"sensitivity_width_ratio_limit":1.5},"windowing":{"step_s":5.0,"time_range":{"tmax_s":null,"tmin_s":null},"window_length_s":50.0}},"config_hash":"4315888197399c7fc4c001e9cbccbd02d48a796400c56db80dd024b2bbd51f1a","derived_operations":[],"external":false,"generated_utc":"2026-10-21T02:15:45Z","grid":{"definition":"f_i = 10^(i/200) Hz on the anchored logarithmic grid","frequency_hz":[0.05011872336272722,0.050699070827470445,0.05128613839913648,0.05188000389289612,0.05248074602497726,0.053088444423098846,0.05370317963702527,0.054325033149243335,0.054954087385762455,0.05559042572704037,0.05623413251903491,0.05688529308438413,0.057543993733715694,0.058210321777087126,0.0588843655355589,0.059566214352901034,0.06025595860743578,0.06095368972401691,0.06165950018614822,0.06237348354824192,0.06309573444801933,0.06382634861905485,0.06456542290346556,0.06531305526474723,0.06606934480075961,0.06683439175686146,0.06760829753919818,0.06839116472814293,0.06918309709189366,0.06998419960022735,0.0707945784384138,0.0716143410212902,0.07244359600749903,0.07328245331389041,0.07413102413009177,0.07498942093324558,0.07585775750291836,0.0767361489361819,0.07762471166286916,0.07852356346100718,0.07943282347242814,0.08035261221856173,0.0812830516164099,0.08222426499470713,0.08317637711026708,0.08413951416451952,0.08511380382023763,0.08609937521846008,0.08709635899560805,0.08810488730080142,0.08912509381337455,0.09015711376059571,0.09120108393559097,0.09225714271547633,0.0933254300796991,0.09440608762859236,0.09549925860214359,0.09660508789898135,0.09772372209558107,0.0988553094656939,0.1,0.10115794542598985,0.10232929922807542,0.10351421666793438,0.10471285480508996,0.10592537251772889,0.10715193052376065,0.10839269140212036,0.1096478196143185,0.11091748152624012,0.11220184543019636,0.11350108156723152,0.1148153621496883,0.11614486138403426,0.11748975549395294,0.11885022274370183,0.12022644346174129,0.12161860006463679,0.12302687708123815,0.1244514611771385,0.12589254117941673,0.12735030810166617,0.1288249551693134,0.13031667784522993,0.1318256738556407,0.1333521432163324,0.13489628825916536,0.13645831365889247,0.1380384264602885,0.13963683610559377,0.14125375446227545,0.1428893958511103,0.14454397707459277,0.14621771744567183,0.14791083881682077,0.14962356560944334,0.15135612484362082,0.15310874616820302,0.1548816618912481,0.15667510701081488,0.15848931924611134,0.16032453906900412,0.16218100973589297,0.16405897731995392,0.16595869074375605,0.16788040181225602,0.16982436524617442,0.17179083871575881,0.17378008287493754,0.17579236139586926,0.1778279410038923,0.1798870915128788,0.18197008586099836,0.18407720014689558,0.18620871366628675,0.18836490894898006,0.19054607179632474,0.1927524913190936,0.19498445997580455,0.19724227361148539,0.19952623149688797,0.20183663636815613,0.20417379446695297,0.20653801558105292,0.20892961308540392,0.21134890398366465,0.2137962089502232,0.21627185237270202,0.21877616239495523,0.22130947096056375,0.22387211385683395,0.22646443075930595,0.2290867652767773,0.23173946499684786,0.2344228815319922,0.23713737056616552,0.23988329190194904,0.24266100950824154,0.24547089156850305,0.24831331052955705,0.251188643150958,0.25409727055493053,0.2570395782768864,0.2600159563165272,0.2630267991895382,0.26607250597988097,0.2691534803926916,0.2722701308077913,0.2754228703338166,0.278612116862977,0.28183829312644537,0.2851018267503909,0.28840315031266056,0.29174270140011666,0.29512092266663853,0.29853826189179594,0.3019951720402016,0.3054921113215513,0.30902954325135906,0.3126079367123955,0.31622776601683794,0.3198895109691398,0.32359365692962827,0.3273406948788382,0.3311311214825911,0.33496543915782767,0.33884415613920255,0.34276778654645035,0.3467368504525316,0.350751873952568,0.35481338923357547,0.3589219346450052,0.36307805477010135,0.3672823004980847,0.37153522909717257,0.3758374042884442,0.3801893963205612,0.3845917820453536,0.3890451449942806,0.3935500754557774,0.3981071705534972,0.4027170343254591,0.40738027780411273,0.4120975190973302,0.4168693834703354,0.4216965034285822,0.42657951880159267,0.43151907682776525,0.436515832240166,0.4415704473533125,0.44668359215096315,0.4518559443749224,0.457088189614875,0.4623810213992603,0.4677351412871982,0.47315125896148047,0.4786300923226383,0.4841723675840993,0.4897788193684462,0.49545019080479025,0.5011872336272722,0.5069907082747044,0.5128613839913648,0.5188000389289611,0.5248074602497725,0.5308844442309884,0.5370317963702527,0.5432503314924332,0.5495408738576245,0.5559042572704036,0.5623413251903491,0.5688529308438415,0.5754399373371569,0.5821032177708715,0.5888436553555889,0.5956621435290105,0.6025595860743578,0.6095368972401691,0.6165950018614822,0.6237348354824193,0.6309573444801932,0.6382634861905486,0.6456542290346555,0.6531305526474723,0.660693448007596,0.6683439175686147,0.6760829753919817,0.6839116472814293,0.6918309709189365,0.6998419960022735,0.7079457843841379,0.7161434102129021,0.72443596007499,0.732824533138904,0.7413102413009175,0.7498942093324559,0.7585775750291838,0.7673614893618189,0.7762471166286917,0.7852356346100718,0.7943282347242815,0.8035261221856173,0.8128305161640993,0.8222426499470711,0.831763771102671,0.8413951416451951,0.8511380382023764,0.8609937521846006,0.8709635899560807,0.881048873008014,0.8912509381337456,0.9015711376059569,0.9120108393559098,0.9225714271547631,0.933254300796991,0.9440608762859234,0.954992586021436,0.9660508789898133,0.9772372209558107,0.9885530946569389,1.0,1.0115794542598986,1.023292992280754,1.035142166679344,1.0471285480508996,1.0592537251772889,1.0715193052376064,1.0839269140212036,1.096478196143185,1.109174815262401,1.1220184543019633,1.135010815672315,1.1481536214968828,1.1614486138403428,1.1748975549395295,1.1885022274370185,1.202264434617413,1.216186000646368,1.2302687708123816,1.244514611771385,1.2589254117941673,1.2735030810166617,1.288249551693134,1.3031667784522993,1.318256738556407,1.333521432163324,1.3489628825916535,1.3645831365889245,1.3803842646028848,1.3963683610559376,1.4125375446227544,1.428893958511103,1.4454397707459274,1.4621771744567182,1.4791083881682074,1.4962356560944334,1.5135612484362082,1.53108746168203,1.5488166189124815,1.566751070108149,1.5848931924611136,1.6032453906900415,1.62181009735893,1.6405897731995394,1.6595869074375607,1.6788040181225603,1.6982436524617444,1.717908387157588,1.7378008287493754,1.7579236139586927,1.7782794100389228,1.7988709151287878,1.8197008586099834,1.840772001468956,1.8620871366628675,1.8836490894898006,1.9054607179632472,1.927524913190936,1.9498445997580451,1.9724227361148536,1.9952623149688795,2.0183663636815607,2.041737944669529,2.0653801558105296,2.0892961308540396,2.113489039836647,2.137962089502232,2.1627185237270203,2.1877616239495525,2.2130947096056377,2.2387211385683394,2.2646443075930596,2.290867652767773,2.3173946499684783,2.344228815319922,2.371373705661655,2.3988329190194904,2.4266100950824154,2.4547089156850306,2.4831331052955705,2.51188643150958,2.540972705549305,2.5703957827688635,2.600159563165272,2.6302679918953817,2.6607250597988097,2.6915348039269156,2.7227013080779123,2.7542287033381663,2.78612116862977,2.8183829312644537,2.8510182675039095,2.884031503126606,2.917427014001167,2.9512092266663856,2.9853826189179595,3.019951720402016,3.054921113215513,3.0902954325135905,3.126079367123955,3.1622776601683795,3.198895109691398,3.2359365692962827,3.273406948788382,3.311311214825911,3.3496543915782766,3.3884415613920256,3.4276778654645037,3.4673685045253166,3.5075187395256804,3.548133892335755,3.5892193464500526,3.630780547701014,3.672823004980846,3.715352290971725,3.758374